topic,representative_doc
0,aurora aurora aurora aurora aurora aurora aurora aurora aurora aurora aurora aurora aurora aurora aurora aurora aurora aurora aurora aurora aurora boreali sky dramatic aurora borealis northern light background aurora sky northern light aurora boreali background breathtake light solar storm northen light background glow green light aurora boreali sky
1,person red kayak pad pad pad pad pad pad pad pad pad pad pad pad pad pad pad pad pad pad pad pad pad banff national park rocky mountain river mountain lake beatiful mountain background beautiful lake background mountain lake canada large rocky mountain mountain lake beautiful lake large mountain mountain background
2,toronto skyline panorama panorama panorama panorama panorama panorama panorama panorama panorama panorama panorama panorama panorama panorama panorama panorama panorama panorama panorama toronto city city toronto toronto cn tower canada entertainment district beautiful city tower city large city beautiful city black woman huge city ice city cool skydome stack city
3,niagara fall niagara fall niagara fall niagara fall niagara fall niagara fall niagara fall niagara fall niagara fall niagara niagara fall beautiful stunning waterfall beautiful waterfall waterfall beautiful waterfall lake huge waterfall lake waterfall immense waterfall water fall stunning waterfall waterfall fall lake river flow waterfall
4,river snow beautiful winter area winter lake setting snowy frozen river winter scene winter photograph winter snowy winter scene snowy winter outside winter landscape snow scene winter atmosphere winter snow ice snowy lake setting winter forest snowy environment snow landscape cover snow winter setting snowy landscape winter landscape
